hate	markmail permalink	type(code, personal, both, unsure)	date	timestamp	mail excerpt
0.6210100248237	http://markmail.org/message/qwv74fvg3pqnk4eo	B	06/07/12 13:29	1341574178	Kay, this needs to be fixed. ... Of course, I'd also suggest that whoever was the genius who thought it was a good idea to read things ONE F*CKING BYTE AT A TIME with system calls for each byte should be retroactively aborted. Who the f*ck does idiotic things like that? How did they noty die as babies, considering that they were likely too stupid to find a tit to suck on?
0.76845286548124	http://markmail.org/message/6ieajwxtjcw6ba3d	B	09/07/12 19:28	1341854914	"sizeof without parenthesis is an abomination, and should never be used. ... The sane solution is: just add the f*cking parenthesis, and don't use the parsing oddity. ... And talking about ""prefix operators"" is a moronic thing to do. ... Think of it as a function, and get over your idiotic pissing match over how long you've both known C. That's irrelevant. ..."
0.664861085017581	http://markmail.org/message/korjohhsmhlgcwti	C	11/07/12 01:52	1341964352	"Absolutely. Anybody who does that is just terminally confused. ""return()"" is in no way a function. ... Here's an example of a really bad use of ""sizeof"" that doesn't have the parenthesis around the argument: sizeof(*p)->member. Quite frankly, if you do this, you should be shot. ... And let's face it: if you write your code so that it's easy to parse for a machine, and ignore how easy it is to parse for a human, I don't want you writing kernel code. ..."
0.781128159151678	http://markmail.org/message/iig6w6kjn4x44a6c	C	15/07/12 16:52	1342363978	"... However, please don't use the *INSANE* ARM ""v8"" naming. There must be something in the water in Cambridge, but the ARM ""version"" naming is just totally broken. ...maybe it all makes sense if you have drunk the ARM cool-aid and have joined the ARM cult, but to sane people and outsiders, it is just a f*cking mess. So - aarch64 is just another druggie name that the ARM people came up with after drinking too much of the spiked water in cambridge. ... - armv8 is totally idiotic and incomprehensible to anybody else...complete and utter nonsense. It's only confusing. Christ. Seriously. The insanity is so strong in the ARM version names that it burns. If it really makes sense to anybody ... you need to have your head examined. So please don't use ""aarch64"", because it's just f*cking crazy. And please don't use ""armv8"", because it's just completely retarded and confused."
0.82990870572725	http://markmail.org/message/stthptqsofmabsfe	B	16/07/12 09:50	1342425018	"Guys, stop it now. Your ""problem"" isn't what any sane person cares about, and isn't what I started the RFC for. Seriously. NOBODY CARES. ... Stop whining."
0.490007805994375	http://markmail.org/message/7uuk2at4vzrd3vve	B	23/07/12 12:08	1343038138	Seriously. People who use BUG() statements like some kind of assert() are a menace to society. They kill machines.
0.65200348375345	http://markmail.org/message/ulgml3kxn4ys56ez	C	31/07/12 14:53	1343739222	And the commit seems to be pure shit. Why is it pure shit? Look at what users are left. THERE ARE NO USERS THAT SET THAT FIELD ANY MORE! ... I've pulled the changes for now, but I absolutely *detest* seeing things like this. ...
0.832673044601956	http://markmail.org/message/bjt22z2iyiidsij3	C	05/09/12 19:46	1346867200	"Stop this ""we can break stuff"" crap. Who maintains udev? Regressions are not acceptable. I'm not going to change the kernel because udev broke, f*ck it. Seriously. More projects need to realize that regressions are totally and utterly unacceptable. ... That just encourages those package maintainers to be shit maintainers. ... And stop blaming the kernel for user space breakage!..."
0.808938865534043	http://markmail.org/message/adaxvroyz33wz2ff	B	14/09/12 14:14	1347624874	This patch is insane. This is pure garbage. Anybody who thinks this: ... is a good idea should be shot. Don't do it. ...That's just f*cking insane. Stop this kind of idiocy. The code looks bad, and the logic is pure shit too.
0.803821124869647	http://markmail.org/message/j3uroyzkdx3nqghw	C	16/09/12 12:56	1347792997	... And it really is all stupidly and badly done. I bet we can make that code faster without really changing the  end result at all, just changing the algorithm. ... In fact, looking at select_idle_sibling(), I just want to puke. The thing is crazy. ... instead it does totally f*cking insane things ... The code is shit. Just fix the shit, instead of trying to come up with some totally different model. Ok? ...
0.800885794263853	http://markmail.org/message/exu4jozhhfdbxf3t	B	30/09/12 10:50	1348995058	"... I don't understand why this seems to be so hard for people to understand. ...this whole thread is a wonderful example of how F*CKING STUPID it was to even consider it. ... SO STOP DOING ABI CHANGES. WE DON'T DO THEM. ...but anybody who does it on purpose ""just because"" should not be involved in kernel development (or library development for that matter)."
0.784159544290281	http://markmail.org/message/2s4sahuqnnfxytjc	B	03/10/12 07:44	1349243047	"Stop this idiocy. ... The fact that you then continually try to make this a ""kernel issue"" is just disgusting. Talking about the kernel solving it ""properly"" is pretty dishonest, when the kernel wasn't the problem in the first place. "
0.752699207020063	http://markmail.org/message/5fqjb4vjzh6idyzm	P	03/10/12 11:06	1349255207	"I also call bullshit on your ""it will surely be fixed when we know what's the right fix"" excuses. The fact is, you've spent the last several months blaming everybody but yourself, and actively told people to stop blaming you: ... despite having clearly seen the patch (you *replied* to it, for chissake, and I even told you in that same thread why that reply was wrong at the time). ... Kay, you are so full of sh*t that it's not funny. You're refusing to acknowledge your bugs, you refuse to fix them even when a patch is sent to you, and then you make excuses for the fact that we have to work around *your* bugs, and say that we should have done so from the very beginning. Yes, doing it in the kernel is ""more robust"". But don't play games, and stop the lying."
0.527212556614933	http://markmail.org/message/drhzuge43dxaqfqb	C	13/10/12 17:33	1350142432	"David, I want to make it very clear that if you *ever* suggest another big include file cleanup, I will say ""f*ck no"" and block you from my emails forever. Ok? So don't bother. We're done with these kinds of games. Forever. It's not worth it, don't ever suggest it again for some other ""cleanup""."
0.561776485750964	http://markmail.org/message/r3sjrhts3t7bqdxm	C	17/10/12 15:44	1350481445	That's just disgusting crazy talk. Christ, David, get a grip on yourself. ...
0.895154699659955	http://markmail.org/message/54aixu5ngczjm46r	C	25/10/12 13:10	1351163404	"Stop doing this f*cking crazy ad-hoc ""I have some other name available"" #defines. Use the same name, for chissake! Don't make up new random names. Just do ... to define the generic thing. Instead of having this INSANE ""two different names for the same f*cking thing"" crap. Stop it. Really. ...So NAK on this whole patch. It's bad. It's ugly, it's wrong, and it's actively buggy."
0.603324217832388	http://markmail.org/message/heh52ti35sar5odm	B	25/10/12 13:16	1351163816	Did anybody ever actually look at this sh*t-for-brains patch? Yeah, I'm grumpy. But I'm wasting time looking at patches that have new code in them that is stupid and retarded. This is the VM, guys, we don't add stupid and retarded code. LOOK at the code, for chrissake. Just look at it. And if you don't see why the above is stupid and retarded, you damn well shouldn't be touching VM code.
0.75370965481074	http://markmail.org/message/kmaq7fosctfrme6y	B	25/10/12 19:56	1351187785	"Rik, *LOOK* at the code like I asked you to, instead of making excuses for it. I'm not necessarily arguing with what the code tries to do. I'm arguing with the fact that the code is pure and utter *garbage*. It has two major (and I mean *MAJOR*) problems, both of which individually should make you ashamed for ever posting that piece of shit: The obvious-without-even-understanding-semantics problem: - it's humongously stupidly written. It calculates that 'flush_remote' flag WHETHER IT GETS USED OR NOT. Christ. I can kind of expect stuff like that in driver code etc, but in VM routines? Yes, the compiler may be smart enough to actually fix up the idiocy. That doesn't make it less stupid. The more-subtle-but-fundamental-problem: - regardless of how stupidly written it is on a very superficial level, it's even more stupid in a much more fundamental way. ... In other words, everything that was added by that patch is PURE AND UTTER SHIT. And THAT is what I'm objecting to. ... Because everything I see about ""flush_remote"" looks just wrong, wrong, wrong. And if there really is some reason for that whole flush_remote braindamage, then we have much bigger problems ... So that patch should be burned, and possibly used as an example of horribly crappy code for later generations. At no point should it be applied."
0.639439238563671	http://markmail.org/message/sw7db56lvg3o6dsu	C	26/10/12 13:11	1351249909	"But dammit, every single discussion I see, you use some *other* argument for it, like ""people don't have initrd"" or whatever crazy crap. That's what I was objecting to."
0.812937602367844	http://markmail.org/message/tjvpodxvfwhdg3gk	B	26/10/12 13:26	1351250809	"Kees, you don't seem to understand. Breaking applications is unacceptable. End of story. It's broken them. Get over it. ... Your ""IT HAS TO BE DONE AT BOOT TIME, THE SKY IS FALLING, NOTHING ELSE IS ACCEPTABLE!"" ranting is a disease. Stop it."
0.772519803183371	http://markmail.org/message/rcu6l5l2a4h5pxeb	C	01/11/12 16:23	1351783431	We've been here before, haven't we? There's so much wrong with this that it's not funny. ... And I know you can do them, because you've done them in the past. So please don't continue to do the above.
0.711655666980764	http://markmail.org/message/fum42xlb6uv455py	C	12/11/12 17:22	1352737338	"What part of ""We don't break user space"" do you have trouble understanding? ... End of discussion. I don't understand why people have such a hard time understanding such a simple concept. ... Seriously, IT IS THAT SIMPLE."
0.922058179089756	http://markmail.org/message/lnxwloth4pmzojvs	B	16/11/12 07:31	1353047498	PLEASE NO! Dammit, why is this disease still so prevalent, and why do people continue to do this crap? __HAVE_ARCH_xyzzy is a f*cking retarded thing to do, and that's actually an insult to retarded people. ... The ... thing is a disease. ...
0.839837190743932	http://markmail.org/message/es442swgwwt3styg	B	19/11/12 17:01	1353340910	"Ingo, stop doing this kind of crap. ... You seem to be in total denial. ... Stop it. That kind of ""head-in-the-sand"" behavior is not conducive to good code, ... Seriously. If you can't make the non-THP case go faster, don't even bother sending out the patches. Similarly, if you cannot take performance results from others, don't even bother sending out the patches. ... So stop ignoring the feedback, and stop shooting the messenger. Look at the numbers, and admit that there is something that needs to be fixed."
0.735113006719663	http://markmail.org/message/untgvt4vwfcdods4	B	21/11/12 09:02	1353484926	"Ingo, stop it already! This is *exactly* the kind of ""blame everybody else than yourself"" behavior that I was talking about earlier. ... Ingo, look your code in the mirror some day, and ask yourself: why do you think this fixes a ""regression""? ...So by trying to make up for vsyscalls only in your numbers, you are basically trying to lie about regressions, and try to cover up the schednuma regression by fixing something else. ... See? That's bogus. When you now compare numbers, YOU ARE LYING. You have introduced a performance regression, and then trying to hide it by making something else go faster. ...The same is true of all your arguments about Mel's numbers wrt THP etc. Your arguments are misleading - either intentionally, of because you yourself didn't think things through. ..."
0.619279996973542	http://markmail.org/message/clmcwj3xd77qm4am	C	29/11/12 11:50	1354186220	... Christ. That code is a mess. ...
0.609408807546925	http://markmail.org/message/erlfs2pnavasy7d4	C	29/11/12 12:10	1354187430	"The games with ""max_block"" are hilarious. In a really sad way. That whole blkdev_get_blocks() function is pure and utter shit."
0.596965036693685	http://markmail.org/message/aqobzj5zdjcu4gn6	C	29/11/12 14:16	1354194987	What a crock. That direct-IO code is hack-upon-hack. Whoever wrote it should be shot. ...
0.864831942365447	http://markmail.org/message/5ggie5rmwjtqg66y	C	01/12/12 13:15	1354364159	No. That patch is braindead. I wouldn't pull it even if it wasn't this late. ... What the f*ck is the point? ... What am I missing?
0.828360049974716	http://markmail.org/message/bg7vnscuskyqygzi	B	05/12/12 07:45	1354689916	"Christ guys. This whole thread is retarded. The *ONLY* reason people seem to have for reverting that is a ""ooh, my feelings are hurt by how this was done, and now I'm a pissy bitch and I want to get this reverted"". Stop the f*cking around already. ... And if your little feelings got hurt, get your mommy to tuck you in, don't email me about it. Because I'm not exactly known for my deep emotional understanding and supportive personality, am I?"
0.771445396647378	http://markmail.org/message/c7eqwpq7yt6xgwwf	C	06/12/12 08:50	1354780231	"Ugh. This patch makes my eyes bleed. ... So I guess this patch fixes things, but it does make me go ""That's really *really* ugly""."
0.883628323990331	http://markmail.org/message/ujigvddzqf3ohtf3	B	07/12/12 10:17	1354871857	"Christ, I promised myself to not respond any more to this thread, but the insanity just continues, from people who damn well should know better. ... So stop these dishonest and disingenious arguments. They are full of crap. ... Every single argument I've heard of from the ""please revert"" camp has been inane. And they've been *transparently* inane, to the point where I don't understand how you can make them with a straght face and not be ashamed. ... Bullshit.... Anybody who claims that our ""process"" requires that things like that go on the mailing list and pass long reviews and discussions IS JUST LYING. ... Read the above arguments, and realise how shrill and outright STUPID that kind of ""we can now do anything without review"" argument is. ... You seem to seriously argue that it's a *bad* thing to put a note that one bit is already in use. That's f*cking moronic.... But that's not what the insane and pointless arguments in this thread have been. The whole thread has been just choch-full of pure STUPID. Please stop the inane and idiotic arguments already. The ""we must review every one-liner, and this destroys and makes a mockery of our review process"" argument in particular has been dishonest and pure crap...."
0.70051047765471	http://markmail.org/message/6zbrogfo7rrqh55a	P	11/12/12 10:35	1355218534	The reading comprehension here is abysmal. ...And none of that matters for my argument AT ALL.
0.812975256984369	http://markmail.org/message/txbei2mxh2uut2ty	C	12/12/12 19:51	1355338289	"So please, just remove that idiotic ""if (!event->attr.exclude_guest)"" test. It's wrong. It cannot possibly do the right thing.  It is totally misdesigned, exactly because you don't even know beforehand if somebody uses virtualization or not."
0.654707615308268	http://markmail.org/message/djo5bcmnmbq2ipk5	P	13/12/12 14:22	1355404931	Christ, why can't people learn?
0.954523604870709	http://markmail.org/message/6ednzyn5lyzuwnna	C	16/12/12 11:57	1355655466	"Ugh. This patch is just too ugly. Conditional locking like this is just too disgusting for words. ... I'm not applying disgusting hacks like this. ... No ""if (write) up_write() else up_read()"" crap. "
0.746910246289839	http://markmail.org/message/lcrjga7m5t5wzdjs	C	18/12/12 08:49	1355816965	"Grr. This is still bullshit. Doing this: ... is fundamentally crap ... So doing *any* of these calculations in bytes is pure and utter crap. ... Anything that works in bytes is simply pure crap. And don't talk to me about 64-bit math and doing it in ""u64"" or ""loff_t"", that's just utterly moronic too. ... So the math is confused, the types are confused, and the naming is confused. Please, somebody check this out, because now *I* am confused. And btw, that whole commit happened too f*cking late too. ... I'm grumpy, because all of this code is UTTER SH*T, and it was sent to me. Why?"
0.668830425521625	http://markmail.org/message/h73brnajmgtx6t6x	B	21/12/12 08:53	1356076390	"Christ, Mel. Your reasons in b22d127a39dd are weak as hell, and then you come up with *THIS* shit instead: ... Heck no. In fact, not a f*cking way in hell. Look yourself in the mirror, Mel. This patch is ugly, and *guaranteed* to result in subtle locking issues, and then you have the *gall* to quote the ""uhh, that's a bit ugly due to some trivial duplication"" thing in commit...  compared to the diseased abortion you just posted..."
0.861779097524422	http://markmail.org/message/3d3xulbwivjeotio	B	23/12/12 09:35	1356251752	"Mauro, SHUT THE FUCK UP! It's a bug alright - in the kernel. How long have you been a maintainer? And you *still* haven't learnt the first rule of kernel maintenance? ... Shut up, Mauro. And I don't _ever_ want to hear that kind of obvious garbage and idiocy from a kernel maintainer again. Seriously. ...The fact that you then try to make *excuses* for breaking user space, and blaming some external program that *used* to work, is just shameful. It's not how we work. Fix your f*cking ""compliance tool"", because it is obviously broken. And fix your approach to kernel programming"
0.816367403353986	http://markmail.org/message/cfwfzsfse5qhdcoq	C	23/12/12 14:28	1356269321	"Yes, I'm upset. Very upset. ... So your question ""why would pulseaudio care"" is totally *irrelevant*, senseless, and has nothing to do with anything.1/2/2013 10:14:00"
0.852183325953959	http://markmail.org/message/dxuql7eif6jzrfgm	B	12/01/13 12:51	1357991486	Christ people. I already reported that it DOES NOT EVEN COMPILE. ... Alan apparently doesn't care about the patch he wrote to even bother fixing that, and the only person who does seem to care enough to carry two fixes around (Andrew) apparently doesn't feel that he's comfortable forwarding it to me ... I'm not picking up random patches from people who don't care enough about those patches to even bother fixing compile errors when reportyed and didn't even send them to me to begin with.
0.634416195361199	http://markmail.org/message/azgsopo63xulybfj	B	14/01/13 09:29	1358152195	"Bullshit. That expectation is just a fact. ... We do not say ""user mode shouldn't"". Seriously. EVER. User mode *does*, and we deal with it. Learn it now, and stop ever saying that again. This is really starting to annoy me. Kernel developers who say ""user mode should be fixes to not do that"" should go somewhere else. "
0.858959804981735	http://markmail.org/message/a33yo653hshtlorn	C	15/01/13 09:36	1358238994	"No way. ... In fact, just to prove how bad it is, YOU SCREWED IT UP YOURSELF. ... But the ""hacky workaround"" absolutely needs to be *automatic*. Because the ""driver writers need to get this subtle untestable thing right"" is *not* acceptable. That's the patch that Ming Lei did, and I refuse to have that kind of fragile crap in the kernel."
0.835011764104301	http://markmail.org/message/lgbu2h56mmrlyhov	C	07/02/13 17:09	1360253351	"No. You guys need to realize that I'm not talking crap like this this late. This is not major bugfixes. I already looked away once just because it's a new filesystem, but enough is enough. This is way way WAY too late to start sendign ""enhancements"". Seriously."
0.816305049876929	http://markmail.org/message/dlcehtdw2iylosx4	B	08/02/13 13:14	1360325660	"No. Your pull requests are just illogical. I have yet to see a single reason why it should be merged. ... That's total bullshit. ... Again, total *bullshit*. ... ... Ingo, it's not us being silly, it is *you*. ... So here, let me state it very very clearly: I will not be merging kvmtool. ... In other words, I don't see *any* advantage to merging kvmtool. I think merging it would be an active mistake, and would just tie two projects together that just shouldn't be tied together. So nobody is ""hurting useful code"", except perhaps you. Explain to me why I'm wrong. I don't think you can. You certainly haven't so far."
0.583506575474461	http://markmail.org/message/zsagmx3labefqnj7	B	08/02/13 16:45	1360338327	NONE of your statements made any sense at all, since everything you talk about could have been done with a separate project. The only thing the lock-step does is to generate the kind of dependency that I ABSOLUTELY DETEST,
0.585813627833514	http://markmail.org/message/wes3zmjkc7cvhvtp	P	09/02/13 10:07	1360400842	"You do realize that none of your arguments touched the ""why should Linus merge the tree"" question at all? Everything you said was about how it's more convenient for you and Ingo, not at all about why it should be better for anybody else. ... You're the only one working on it, so being convenient for you is the primary issue. Arguments like that actively make me not want to merge it, ..."
0.60181167503935	http://markmail.org/message/fajyuralww7ecu46	B	09/02/13 11:57	1360407438	"Why? You've made this statement over and over and over again, and I've dismissed it over and over and over again because I simply don't think it's true. It's simply a statement with nothing to back it up. Why repeat it? THAT is my main contention. I told you why I think it's actually actively untrue. ... So you make these unsubstantiated claims about how much easier it is, and they make no sense. You never explain *why* it's so magically easier. ... Anyway, I'm done arguing. You can do what you want, but just stop misrepresenting it as being ""linux-next"" material unless you are willing to actually explain why it should be so."
0.674947029327941	http://markmail.org/message/v7zrdos3ivvwyy3j	B	11/02/13 15:32	1360593123	"Ingo, stop this idiotic nonsense. You seem to think that ""kvmtool is useful for kernel"" is somehow relevant. IT IS TOTALLY IRRELEVANT."
0.543522330605922	http://markmail.org/message/v4qqvcyonunfr4f7	C	11/02/13 19:32	1360607559	Christ. This is so ugly that it's almost a work of art.
0.898171212539887	http://markmail.org/message/4n3bz5v7zcilvwec	C	13/02/13 08:20	1360740019	"Did anybody actually look at the code generation of this? Adding an external function call is *horrible*, ... Guys, the biggest cost of a function call is not the ""call"" instruction, it's all the crap around it ... And the excuse is ""so that we can add stuff to the wait loop"". What the f*ck? ... and which is something we have actively *avoided* in the past, because back-off is a f*cking idiotic thing, and the only real fix for contended spinlocks is to try to avoid the contention and fix the caller to do something smarter to begin with. In other words, the whole f*cking thing looks incredibly broken. At least give some good explanations for why crap like this is needed ..."
0.673548399428513	http://markmail.org/message/u7s4aiysqw22yoks	B	13/02/13 14:39	1360762790	So you're potentially making things worse for just about everybody, in order to fix a problem that almost nobody can actually see. And apparently you don't even know the problem.. and as I already explained, THAT IS PURE AND UTTER BULLSHIT. It may make things WORSE. On all the things you haven't run to check that it does better. You just stated something that is not at all necessarily true. .... That's pure bullshit. ... And yet you go on to say that it will fix performance problems THAT WE DON'T EVEN KNOW ABOUT! After seeing *proof* to the exact contrary behavior! What f*cking planet are you from, again? Christ, that's hubris. ...
0.679866804765995	http://markmail.org/message/yfj2wsfb53wooham	C	15/02/13 17:44	1360946650	Christ, we should just try to get rid of the personality bits entirely, they are completely insane
0.687631886740125	http://markmail.org/message/ri3kexilpdikwffk	C	21/02/13 08:39	1361432355	Quite frankly, this is f*cking moronic.
0.768000665110527	http://markmail.org/message/5vnikbcmtiy37trs	B	21/02/13 08:58	1361433488	Guys, this is not a dick-sucking contest. ... If Red Hat wants to deep-throat Microsoft, that's *your* issue.
0.878688755949116	http://markmail.org/message/ayphowwkqhokglgq	C	21/02/13 10:02	1361437377	"Quite frankly, I doubt that anybody will ever care, ... Plus quite frankly, signing random kernel vendor modules (indirectly) with a MS key is f*cking stupid to begin with. In other words, I really don't see why we should bend over backwards, when there really is no reason to. It's adding stupid code to the kernel only to encourage stupidities in other people. ... And the whole ""no, we only think it makes sense to trust MS keys"" argument is so f*cking stupid that if somebody really brings that up, I can only throw my hands up and say ""whatever"". In other words, none of this makes me think that we should do stupid things just to perpetuate the stupidity. "
0.905658073206459	http://markmail.org/message/noa6avyls3prnljg	C	21/02/13 10:21	1361438466	Ugh. The placement of that #ifndef is just horrible, please don't do that.
0.617611993096367	http://markmail.org/message/fg2kiaccjm3umykj	B	21/02/13 10:25	1361438706	Your arguments only make sense if you accept those insane assumptions to begin with. And I don't.
