hate	markmail permalink	type(code, personal, both, unsure)	date	timestamp	mail excerpt
0.764044129341103	http://markmail.org/message/ymksyompaadrlpeo	C	22/02/13 13:07	1361534857	The softirq semantics are perfectly fine. Don't blame softirq for the fact that irq_exit() has had shit-for-brains for a long time. ... Don't blame the wrong code here.
0.844313808408253	http://markmail.org/message/crdmpdgia7w2kc3v	B	22/02/13 16:29	1361546986	Rafael, please don't *ever* write that crap again. ... Seriously. Why do I even have to mention this? Why do I have to explain this to somebody pretty much *every* f*cking merge window? This is not a new rule. ... So you should be well acquainted with the rule, and I'm surprised to hear that kind of utter garbage from you in particular. ...
0.724450098397838	http://markmail.org/message/nkatkgctxzv6efs2	B	25/02/13 19:31	1361817086	"And you're happy shilling for a broken model? ... Your arguments constantly seem to miss that rather big point. You think this is about bending over when MS whispers sweet nothings in your ear.. ... You, on the other hand, seem to have drunk the cool-aid on the whole ""let's control the user"" crap. Did you forget what security was all about?"
0.647051420097368	http://markmail.org/message/jv7pjzgaugm4bbud	B	25/02/13 19:44	1361817886	"How f*cking hard is it for you to understand? Stop arguing about what MS wants. We do not care. We care bout the *user*. You are continually missing the whole point of security, and then you make some idiotic arguments about what MS wants you to do. It's irrelevant. The only thing that matters is what our *users* want us to do, and protecting *their* rights. As long as you seem to treat this as some kind of ""let's please MS, not our users"" issue, all your arguments are going to be crap."
0.625798160655577	http://markmail.org/message/agrpwdrqk3htku5x	B	25/02/13 20:30	1361820631	"... Stop the fear mongering already. So here's what I would suggest, and it is based on REAL SECURITY and on PUTTING THE USER FIRST instead of your continual ""let's please microsoft by doing idiotic crap"" approach. ... Quite frankly, *you* are what he key-hating crazies were afraid of. You peddle the ""control, not security"" crap-ware. The whole ""MS owns your machine"" is *exactly* the wrong way to use keys."
0.72288842929421	http://markmail.org/message/pebyvitew3mmel2h	P	25/02/13 20:43	1361821399	This is the kind of totally bogus crap that no sane person should ever spout. Stop it.
0.838592740625719	http://markmail.org/message/5kd5gx6lowz34hwg	C	27/02/13 08:56	1361951805	I would love to blame gcc, but no, I think the code is crap. ... And gcc would be completely correct. That test is moronic.
0.630892693369288	http://markmail.org/message/qmxezyrnc4rgeiwt	B	28/02/13 20:18	1362079084	Has Chris Ball been told what an incredible pain this kind of crap is, and that there's a damn good reason why WE DO NOT REBASE PUBLIC TREES THAT OTHERS MAY BE BASING THEIR DEVELOPMENT ON! Chris, can you hear me shouting? Don't do that.
0.814898612788688	http://markmail.org/message/7vojjlvgvx3pg6ih	C	01/03/13 10:03	1362128589	Yeah, that would be a no. I finally got to look at the new architectures and be ready to pull them, and you just made sure I won't pull this. This is exactly the kind of crap I don't want to see in *any* pull requests, ... Why the f*ck are you doing back-merges? There is no excuse for even a single one. And here you have just about one back-merge per commit. No, no no.
0.746240823907864	http://markmail.org/message/z3sqbcs5zvttxvs5	C	07/03/13 07:55	1362639302	No, guys. That cannot work. It's a completely moronic idea. 
0.658394270909275	http://markmail.org/message/luivhcj5s3tmnhg3	P	07/03/13 13:50	1362660659	Yeah, I'm a f*cking moron.
0.89429225368848	http://markmail.org/message/wnh5hpofc6u5ux3k	B	26/03/13 09:07	1364285265	"Bullshit. This is a regression, and it needs to be fixed. The ""device needs power"" crap is just that - crap. Nobody cares. ... Claiming that we need to know the power regulator for an accelerometer is total utter idiocy and crap. ... The notion that you have to have regulator information in order to use some random device is insanity. I don't understand how you can even start to make excuses like that. It's so obviously bogus that it's not even funny. Why do I have to explain the ""no regressions"" to long-time kernel maintainers EVERY SINGLE RELEASE? What the f*ck is *wrong* with you people? Seriously?"
0.72609077025688	http://markmail.org/message/dnkiqq7dw4wc5ylj	C	29/03/13 11:08	1364551680	No it's not. ... which is entirely and utterly pointless. Christ, the amount of confusion in that tree.  ... Don't do this kind of thing. That branch is pointless, and just confused you.
0.448290342883974	http://markmail.org/message/fqeuavztempqtt4e	C	29/03/13 12:56	1364558207	Because you screwed up that pull request, and I argue that you screwed up exactly *because* it's ambiguous and confusing.
0.858225316657974	http://markmail.org/message/zydmz4wtbkm5raty	C	06/04/13 09:13	1365232395	This is all *COMPLETELY* wrong. ... Fix ARC, don't try to blame generic code. You should have asked yourself why only ARC saw this bug, when the code apparently works fine for everybody else!
0.762227344574261	http://markmail.org/message/tymjfm4sler2maof	C	07/04/13 21:47	1365364062	That's absolutely insane. It's insane for two reasons: - it's not SUFFICIENT. ... - it's POINTLESS and WRONG. ...
0.642801543359638	http://markmail.org/message/tquutcp3how7so4i	P	09/04/13 07:32	1365485522	I'm a moron.
0.764311340776219	http://markmail.org/message/ww3kki6aafcc3int	B	24/04/13 14:30	1366806614	"Bullshit. That's exactly the wrong kind of thinking. ... This whole discussion has been f*cking moronic. The ""security"" arguments have been utter shite with clearly no thinking behind it, the feature is total crap ... and I'm seriously considering just getting rid of this idiotic dmesg_restrict thing entirely. Your comment is the very epitome of bad security thinking."
0.847415835636989	http://markmail.org/message/z4tgggqhp4bzaobu	C	30/04/13 07:49	1367300953	Why does this have the crappy cputime scaling overflow code, ... WTF happened here? I and others spent efforts so that we wouldn't need this kind of crap.
0.907571496503243	http://markmail.org/message/x7dppnevszkf32t7	C	01/05/13 10:10	1367395851	Ugh. Sorry, but this patch just looks stupid.
0.881317719791551	http://markmail.org/message/czm34752nkrdcsyl	P	03/05/13 09:55	1367567745	"F*ck yes it does. It means that NOBODY EVEN TEST-COMPILED THE TREE THAT GOT SENT TO ME. WTF? If that's not ""irresponsible and lame"", I don't know what the hell is."
0.857176751784924	http://markmail.org/message/bfb52yzgga25ekbl	B	03/05/13 14:48	1367585303	And you are making that excuse exactly *why*? ... Stop making excuses for bad behavior. Just admit that you guys screwed up rather than trying to soldier on. ... That's a f*cking disgrace. ... Stop making excuses for it. Really. It just makes you look even worse. ...
0.841706410182745	http://markmail.org/message/k3wjhpzykhjs6d46	C	11/05/13 15:22	1368278534	This has so much wrong that I don't know where to start.
0.811682349964829	http://markmail.org/message/gubc7op3sndc26kx	C	09/06/13 14:33	1370781193	"Not pulled, because your hamster smells of eldeberries. This is not just bugfixes. In fact, as far as I can tell, this *introduces* bugs, ... I'm f*cking tired of people having problems understanding ""we're past rc5"". If it's not something you would call stable material, you shouldn't send it to me."
0.898389071886843	http://markmail.org/message/ahfmn75iictvv7hs	C	10/06/13 13:03	1370862227	That patch is really ugly. And it doesn't make much sense. ... So the patch seems to make things just worse.
0.74514543967033	http://markmail.org/message/n2llxam2eakjj5dx	P	07/07/13 14:31	1373200311	What the F*CK is wrong with people?
0.499798469578438	http://markmail.org/message/2sa6oh7tlbn6wpst	C	09/07/13 19:50	1373392218	David, what the heck are you doing? ... Seriously. Those commits now have TOTALLY MISLEADING summary messages. ...
0.895006549813143	http://markmail.org/message/34bxbzbympklsjik	C	10/07/13 19:11	1373476290	THIS IS SOME HORRIBLY BROKEN CRAP. ... Dammit, this has happened before, and it was broken then, and it is broken now. If they do, they are *F*CKING*BROKEN*. ... You need to start being more careful. ... There is no excuse for this. That commit is shit. ... And that totally crap commit is even marked for stable. I hate hate hate when this kind of crap happens. 
0.820733294099069	http://markmail.org/message/pnxj6xr332gu4oog	C	11/07/13 12:33	1373538790	Grr. I hate it when people do this. Your merge message sucks.
0.594767694571466	http://markmail.org/message/mmvlphelw5gea4lw	B	12/07/13 08:22	1373610124	"That's f*cking sad. You know *why* it's sad? ... Now, that should make you think about THE ABSOLUTE CRAP YOU MARK FOR -stable! ... Listen to yourself. In fact, there is a damn good solution"": don't mark crap for stable, and don't send crap to me after -rc4. ... Greg, the reason you get a lot of stable patches seems to be that you make it easy to act as a door-mat. ... You may need to learn to shout at people."
0.813954024912302	http://markmail.org/message/6h3gtqeizljyjqio	C	13/07/13 15:40	1373722801	What the F*CK, guys? This piece-of-shit commit is marked for stable, but you clearly never even test-compiled it, did you? ...The declaration for gate_desc is very very different for 32-bit and 64-bit x86 for whatever braindamaged reasons. Seriously, WTF? I made the mistake of doing multiple merges back-to-back with the intention of not doing a full allmodconfig build in between them, and now I have to undo them all because this pull request was full of unbelievable shit. And why the hell was this marked for stable even *IF* it hadn't been complete and utter tripe? It even has a comment in the commit message about how this probably doesn't matter. So it's doubly crap: it's *wrong*, and it didn't actually fix anything to begin with. There aren't enough swear-words in the English language, so now I'll have to call you perkeleen vittup just to express my disgust and frustration with this crap.
0.56989378938028	http://markmail.org/message/h36hza3w6tc6wc3p	C	14/07/13 11:33	1373794432	Ok. So your commit message and explanation was pure and utter tripe,
0.819841429399543	http://markmail.org/message/sid3n3nvz5cewzdq	C	26/07/13 17:29	1374852559	Ugh. I dislike this RCU'ism. It's bad code. It doesn't just look ugly and complex, it's also not even clever. It is possible that the compiler can fix up this horrible stuff and turn it into the nice clever stuff, but I dunno.
0.824927722167148	http://markmail.org/message/w5jkhwsqqr765nut	C	22/08/13 09:53	1377157994	Please don't do these ugly and pointless preprocessor macro expanders that hide what the actual operation is. And this is really ugly. Again it's also then hidden behind the ugly macro. ...
0.698227424180082	http://markmail.org/message/jthwd7tcgkdjujxz	B	05/09/13 13:41	1378381309	"Yes it damn well is. Stop the f*cking stupid arguments, and instead listen to what I say. Here. Let me bold-face the most important part for you, so that you don't miss it in all the other crap: ... Nothing else. Seriously. Your ""you can't do it because we copy backwards"" arguments are pure and utter garbage, ... You're complicating the whole thing for no good reason. ..."
0.616728949463229	http://markmail.org/message/3e7kuotauypbggjd	C	23/09/13 13:08	1379934493	We should definitely drop it. The feature is an abomination. I thought gcc only allowed them at the end of structs, in the middle of a struct it's just f*cking insane beyond belief.
0.301180129969207	http://markmail.org/message/gfq4zrm3sjv3dfg7	B	05/10/13 16:17	1380982652	What drugs are you on? Your example is moronic, and against all _documented_ uses of chroot.
0.797550940052978	http://markmail.org/message/eoldtrf5kv43ryk7	C	10/10/13 18:42	1381423347	I can't even begin to say whether this is a good solution or not, because that if-conditional makes me want to go out and kill some homeless people to let my aggressions out. Can we please agree to *never* write code like this? Ever?
0.852199206638371	http://markmail.org/message/6ed7vcd3drtzru2e	C	10/10/13 11:48	1381398529	"The whole ""it's more convenient to use sleeping locks"" argument is PURE AND UTTER SHIT when it comes to really core code. ... Seriously. Your argument is bad, but more importantly, it is *dangerously* bad. It's crap that results in bad code: and the bad code is almost impossible to fix up later..."
0.701378112736595	http://markmail.org/message/zh5hmrt35h7aw7qp	C	15/10/13 10:47	1381826864	So get your act together, and push back on the people you are supposed to manage. Because this is *not* acceptable for post-rc5, and I'm giving this single warning. Next time, I'll just ignore the sh*t you send me. Comprende?
0.856902684279614	http://markmail.org/message/epfiszw6jrzdhycs	C	25/10/13 07:33	1382679185	Not acceptable. ... Plase stop sending me untested crap that doesn't even compile cleanly!
0.921042540209971	http://markmail.org/message/gxmmhefjyijrucsd	B	27/10/13 12:22	1382872960	"Stop this idiotic ""blame gcc bug"" crap. Which part of my explanation for why it was *NOT* a compiler bug did you not understand? ... Stop the f*cking around already! The  whole ""we expect ww_ctx to be null"" thing shows that YOU DO NOT SEEM TO UNDERSTAND WHAT THE TEST ACTUALLY IS! ... Christ, can you really not understand that? NO NO NO NO. No a f*cking thousand times. It's not ""too broken in gcc"". It's too broken in the source code, and the fact that you don't even understand that is sad. You wrote the code, and you seem to be unable to admit that *your* code was buggy. It's not a compiler bug. It's your bug. Stand up like a man, instead of trying to flail around and blame anything else but yourself. So guys, get your act together, and stop blaming the compiler already."
0.74011502589211	http://markmail.org/message/4ebgm5lnsavu7vya	C	01/11/13 11:04	1383300243	This looks totally invalid....Your patch is horribly wrong.
0.923906284338418	http://markmail.org/message/65bftkuk3cumvw26	P	15/11/13 11:55	1384512930	"You need to also explain *why* people should apply it, and stop the f*cking idiotic arguing every time somebody comments about your patches.Stop this idiotic ""blame gcc bug"" crap. Which part of my explanation for why it was *NOT* a compiler bug did you not understand? ... Stop the f*cking around already! The  whole ""we expect ww_ctx to be null"" thing shows that YOU DO NOT SEEM TO UNDERSTAND WHAT THE TEST ACTUALLY IS! ... Christ, can you really not understand that? NO NO NO NO. No a f*cking thousand times. It's not ""too broken in gcc"". It's too broken in the source code, and the fact that you don't even understand that is sad. You wrote the code, and you seem to be unable to admit that *your* code was buggy. It's not a compiler bug. It's your bug. Stand up like a man, instead of trying to flail around and blame anything else but yourself. So guys, get your act together, and stop blaming the compiler already."
0.746996483533493	http://markmail.org/message/sjy3fjyyyyfn3b55	P	15/11/13 12:15	1384514117	My point is that I have sixteen pointless messages in my mbox, half of which are due to just your argumentative nature.
0.748196495861618	http://markmail.org/message/grt4baiscs4yr6d6	C	19/11/13 10:47	1384854433	This seems to be just pure stupid. ...Even the help message is pure and utter garbage ... Asking the user questions that make no f*cking sense to ask is stupid. And I'm not knowingly pulling stupid crap.
0.801111673168947	http://markmail.org/message/xcbchfqfnnew7g7r	B	21/11/13 16:16	1385047009	"Why? You're wrong. I mean, anybody who disagrees with me is pretty much wrong just on pure principles, but I actually mean a deeper kind of wrong than that. I mean a very objective ""you're clearly wrong"". ... .. and then you use a totally bogus example to try to ""prove"" your point. ... Your example is pure and utter shit, since you still get confused about what is actually const and what isn't. ... But that argument is BULLSHIT, because the fact is, the function *doesn't* do what you try to claim it does."
0.790756814333598	http://markmail.org/message/x75diahvbizh73rl	C	03/12/13 10:59	1386064793	I think that code is bad, and you should feel bad.
0.690260971181633	http://markmail.org/message/s27yeuhbzjclo5kk	C	09/12/13 19:58	1386615491	Grr. I've pulled it, but looking at that history, it's just pure and utter f*cking garbage.
0.808209201906317	http://markmail.org/message/zyo2xf6zmgckhmki	B	10/12/13 12:43	1386675784	"No it's not. Thomas, stop this crap already. Look at the f*cking code carefully instead of just dismissing cases. ... So, Christ, Thomas, you have now *twice* dismissed a real concern with totally bogus ""that can never happen"" by explaining some totally unrelated *simple* case rather than the much more complex case. So please. Really. Truly look at the code and thing about it, or shut the f*ck up. No more of this shit where you glance at the code, find some simple case, and say ""that can't happen"", and dismiss the bug-report."
0.676094413400554	http://markmail.org/message/hsdp434ozq5z26cc	C	19/12/13 12:01	1387450913	Ok, I'm sorry, but that's just pure bullshit then. ... This code is pure and utter garbage. It's beyond the pale how crazy it is.
0.772032774832641	http://markmail.org/message/j2lpjzyu34b7c7bc	C	23/12/13 10:42	1387791760	No. I think it makes sense to put a big warning on any users you find, and fart in the general direction of any developer who did that broken pattern. Because code like that is obviously crap.
0.814078366045888	http://markmail.org/message/n3enavikpanbpb2g	C	06/01/14 21:25	1389039934	This looks completely broken to me. ... Wtf? Am I missing something?
0.746315757529654	http://markmail.org/message/u7ygpolgnjcnea2t	C	09/01/14 15:53	1389279198	Yeah, it's a hack, and it's wrong, and we should figure out how to do it right.
0.615374380008619	http://markmail.org/message/tlfqf2fwnayq3rn6	C	17/01/14 17:28	1389976129	"Yes, yes, it may ""work"", but I'm not pulling that kind of hack just before a release....But dammit, using this kind of hackery, ... is just not acceptable."
0.821698890389565	http://markmail.org/message/qp4kumio6pxploxd	B	21/01/14 10:11	1390295474	The fact that it doesn't even compile makes me doubt your statement that it has been in linux-next. ... I fixed it up properly in the merge, but please try to figure out how the hell this passed through the cracks.
0.644268880722142	http://markmail.org/message/5rpvx3sf2wcvzrf4	S	21/01/14 17:50	1390323047	You messed up the pull request too.. The branch name is missing from that git line, even if you did mention it a few lines earlier...
0.589420664440607	http://markmail.org/message/i32holblxwzsml7q	B	21/01/14 18:46	1390326404	"Adding Andrea to the Cc, because he's the author of that horridness. Putting Steven's test-case here as an attachement for Andrea, maybe that makes him go ""Ahh, yes, silly case"". Also added Kirill, because he was involved the last _PAGE_NUMA debacle."
0.811377426932941	http://markmail.org/message/f4xaietzxxp4sziz	C	22/01/14 10:23	1390382623	It's misleading crap. Really. Just do a quick grep for that bit, and you see just *how* confused people are about it:...think about it. Just *THINK* about how broken that code is. The whole thing is a disaster. _PAGE_NUMA must die. It's shit.
0.801764456394772	http://markmail.org/message/uk2l2qvdklmg57ok	C	26/01/14 14:27	1390742872	This was obviously brought on by my frustration with the currently nasty do_notify_resume() always returning to iret for the task_work case, and PeterZ's patch that fixed that, but made the asm mess even *worse*.
0.558421257328433	http://markmail.org/message/lsyehokft5zpedb6	B	28/01/14 09:12	1390896741	But dammit, if you build with debug_info and then strip the end result, you're just insane. You made your build take ten times longer, use ten times more diskspace, and then you throw it all away. Crazy.
0.520737823507589	http://markmail.org/message/njkznzxzq4hstqfa	P	28/01/14 12:24	1390908292	If most of the oopses you decode are on your own machine with your own kernel, you might want to try to learn to be more careful when writing code. And I'm not even kidding.
0.843447624873788	http://markmail.org/message/tb6h6vhyia34gc2h	B	28/01/14 18:44	1390931048	"Dammit, this is pure shit, and after having to deal with yet another pointless merge conflict due to stupid ""cleanups"" in Makefiles, IT DOES NOT EVEN COMPILE. And no, that's not due to a merge error of mine. It was that way in your tree. Hulk angry. Hulk smash. I fixed it up in the merge, but I shouldn't need to. This should have been caught in -next, and even if you compile for ARM as your primary target, I know *damn* well that no sane ARM developer actually compiles *on* ARM (because there are no machines where it's worth the pain), so you should make sure that the x86-64 build works too. If I can find compile errors within a couple of minutes of pulling and it's not a merge error of mine, the tree I'm pulling from is clearly crap. So I'm more than a bit grumpy. Get your act together, and don't send me any more shit. In fact, I would suggest you send nothing but obvious fixes from now on in this release. Because I won't be taking anything else."
0.889635217430461	http://markmail.org/message/t5yj7ynloclmysyc	C	02/02/14 11:27	1391336879	"I don't think that works. That completely breaks randomize_stack_top(). So I'm not going to pull the parisc tree, this needs to be resolved sanely. In fact, I think that change to fs/exec.c is just completely broken:... and that ""+1"" just doesn't make sense, and fundamentally breaks STACK_RND_MASK. It also seems to be entirely pointless, ...So NAK on that whole fs/exec.c change. Afaik it's just wrong, and it's stupid."
0.630184621061049	http://markmail.org/message/5eb6xkp3u47zmjrm	C	04/02/14 12:18	1391512698	"Oh, please, that's a British-level understatement. It's like calling WWII ""a small bother"". That's too ugly to live."
0.449750215987884	http://markmail.org/message/txurofhjfbinempf	C	04/02/14 19:37	1391539040	And that audit code really is aushit. I think I found a bug in it while just scanning it:
0.525431861535091	http://markmail.org/message/g26urbel3sxbrsae	U	07/02/14 12:18	1391771892	Grr. You missed the branch name. I can see from the SHA1 (and historical pull requests) that you meant the usual 'v4l_for_linus' branch, but please be more careful.
0.872563214072196	http://markmail.org/message/qlbh3nkuj6wcfy5q	C	08/02/14 11:45	1391856329	"I absolutely *detest* this patch....because the particular use in question is pure and utter garbage.... And btw, that horrid crap called ""kmap_to_page()"" needs to die too. When is it *ever* valid to use a kmap'ed page for IO? Here's a clue: never. I notice that we have a similar abortion in ""get_kernel_page[s]()"", which probably has the same broken source. We need to get *rid* of this crap, rather than add more of it. ... So who the f*ck sends static module data as IO? Just stop doing that. What's And that idiotic kmap_to_page() really needs to die too. Those *disgusting* get_kernel_page[s]() functions ... Mel, Rik, this needs to die. I'm sorry I didn't notice how crap it was earlier. ...Please let's just fix the real problem, don't add more horridness on top..."
0.72089149286705	http://markmail.org/message/jetbeut5u63i4hf7	C	09/02/14 16:56	1391961361	"What BS is that? If you use an ""atomic_store_explicit()"", by definition you're either (a) f*cking insane (b) not doing sequential non-synchronizing code ... and a compiler that assumes that the programmer is insane may actually be correct more often than not, but it's still a shit compiler. Agreed? So I don't see how any sane person can say that speculative writes are ok. They are clearly not ok. Speculative stores are a bad idea in general. They are completely invalid for anything that says ""atomic"". This is not even worth discussing."
0.647358037294621	http://markmail.org/message/meuw4jl5eg3vbbtv	C	09/02/14 17:23	1391963031	If you really think that, I hope to God that you have nothing to do with the C standard or any actual compiler I ever use. Because such a standard or compiler would be shit. It's sadly not too uncommon
0.709715222272489	http://markmail.org/message/csyqhyykuv25rgxf	C	13/02/14 16:37	1392305850	"Is this whole thread still just for the crazy and pointless ""max_sane_readahead()""? Or is there some *real* reason we should care? Because if it really is just for max_sane_readahead(), then for the love of God, let us just do this ... and bury this whole idiotic thread."
0.891369005158643	http://markmail.org/message/bdrn7aqw4anxhqly	B	14/02/14 11:50	1392375001	"Quite frankly, I think it's stupid, and the ""documentation"" is not a benefit, it's just wrong.... I don't understand why you even argue this. Seriously, Paul, you seem to *want* to think that ""broken shit"" is acceptable, and that we should then add magic markers to say ""now you need to *not* be broken shit"".... Seriously, this whole discussion has been completely moronic. I don't understand why you even bring shit like this up... I mean, really? Anybody who writes code like that, or any compiler where that ""control_dependency()"" marker makes any difference what-so-ever for code generation should just be retroactively aborted. ... Seriously. This thread has devolved into some kind of ""just what kind of idiotic compiler cesspool crap could we accept"". Get away from that f*cking mindset. We don't accept *any* crap. Why are we still discussing this idiocy? It's irrelevant. ..."
0.875833025254089	http://markmail.org/message/q3qh7x54i6fzv2ah	B	15/02/14 11:15	1392459334	No, please don't use this idiotic example. It is wrong....Anybody who argues anything else is wrong, or confused, or confusing.
